id,titulo,autor,ano,preco
1,A Vida Imortal de Henrietta Lacks,Rebecca Skloot,2010,29.99
2,Madame Curie: Uma Biografia,Eve Curie,1937,60.0
4,Lise Meitner: A Life in Physics,Ruth Lewin Sime,1996,90.0
5,Women in Science: 50 Fearless Pioneers Who Changed the World,Rachel Ignotofsky,2016,100.0
6,Lean In: Women Work and the Will to Lead,Sheryl Sandberg,2013,60.0
7,Becoming,Michelle Obama,2018,60.0
8,Steve Jobs: A Biografia,Walter Isaacson,2011,60.0
9,Brotopia: Breaking Up the Boys' Club of Silicon Valley,Emily Chang,2018,90.0
10,Algorithms of Oppression: How Search Engines Reinforce Racism,Safiya Umoja Noble,2018,80.0
